<?xml version="1.0" encoding="UTF-8"?>
<tns:moveSoldOffering xmlns:tns="http://pcom.redknee.com/om/itemType" xmlns:xsi="http://www.w3.org/2001/XMLSchema-instance" xsi:schemaLocation="http://pcom.redknee.com/om/itemType moveSoldOfferings.xsd ">
  <spid>0</spid>
  <balanceCarryOver>false</balanceCarryOver>
  <oldBAN>oldBAN</oldBAN>
  <newBAN>newBAN</newBAN>
  <oldSubscriberID>oldSubscriberID</oldSubscriberID>
  <newSubscriberID>newSubscriberID</newSubscriberID>
  <moveReferenceId>0</moveReferenceId>
</tns:moveSoldOffering>
